{
  "$schema": "https://json-schema.org/draft/2020-12/schema",
  "title": "Mosaic exchange (datapass.mosaic-exchange, version 1)",
  "$comment": "Written by hand from src/platform/mosaicExchange.ts (validateExchange); keep the two in step. The validator also checks what a schema cannot: unique ids, dependsOn and producedBy references, acyclic dependencies. See docs/MOSAIC_EXCHANGE.md.",
  "type": "object",
  "required": ["format", "version", "producer", "exportedAt", "runtime", "notebooks", "artifacts", "provenance"],
  "properties": {
    "format": { "const": "datapass.mosaic-exchange" },
    "version": { "const": 1 },
    "producer": {
      "type": "object",
      "required": ["app", "version"],
      "properties": {
        "app": { "type": "string", "minLength": 1, "maxLength": 100, "pattern": "\\S", "description": "mosaic-studio or datapass-workbench." },
        "version": { "type": "string", "minLength": 1, "maxLength": 100, "pattern": "\\S" }
      }
    },
    "exportedAt": { "type": "string", "pattern": "^\\d{4}-\\d{2}-\\d{2}T\\d{2}:\\d{2}(:\\d{2}(\\.\\d+)?)?(Z|[+-]\\d{2}:\\d{2})$" },
    "runtime": {
      "type": "object",
      "required": ["engine", "version"],
      "properties": {
        "engine": { "enum": ["duckdb-native", "duckdb-wasm"], "description": "The engine of the producer. DuckDB-WASM and native DuckDB never share a mutable database." },
        "version": { "type": "string", "minLength": 1, "maxLength": 100, "pattern": "\\S", "description": "The DuckDB version, or unknown." }
      }
    },
    "notebooks": {
      "type": "array",
      "minItems": 1,
      "maxItems": 50,
      "items": {
        "type": "object",
        "required": ["id", "title", "cells"],
        "properties": {
          "id": { "$ref": "#/$defs/id" },
          "title": { "type": "string", "minLength": 1, "maxLength": 200, "pattern": "\\S" },
          "cells": {
            "type": "array",
            "minItems": 1,
            "maxItems": 500,
            "items": {
              "type": "object",
              "required": ["id", "kind", "source", "dependsOn"],
              "properties": {
                "id": { "$ref": "#/$defs/id" },
                "kind": { "enum": ["sql", "python", "polars", "markdown"] },
                "source": { "type": "string", "maxLength": 200000, "description": "The cell's text. An import writes it to a file; it never runs it." },
                "dependsOn": { "type": "array", "items": { "$ref": "#/$defs/id" }, "description": "Cells of the same notebook this cell reads from; acyclic." }
              }
            }
          }
        }
      }
    },
    "artifacts": {
      "type": "array",
      "items": {
        "type": "object",
        "required": ["id", "kind", "name"],
        "properties": {
          "id": { "$ref": "#/$defs/id" },
          "kind": { "enum": ["table", "file"] },
          "name": { "type": "string", "minLength": 1, "maxLength": 300, "pattern": "\\S", "description": "A table name (layer.table) or a workspace-relative file path." },
          "sha256": { "type": "string", "pattern": "^[a-f0-9]{64}$" },
          "producedBy": {
            "type": "object",
            "required": ["notebook", "cell"],
            "properties": { "notebook": { "$ref": "#/$defs/id" }, "cell": { "$ref": "#/$defs/id" } },
            "description": "Absent for an input file such as a dataset."
          }
        },
        "not": { "anyOf": [{ "required": ["data"] }, { "required": ["rows"] }, { "required": ["content"] }, { "required": ["bytes"] }] },
        "description": "Names and hashes only, never data."
      }
    },
    "provenance": {
      "type": "object",
      "required": ["source", "runs"],
      "properties": {
        "source": { "type": "string", "minLength": 1, "maxLength": 400, "pattern": "\\S" },
        "commit": { "type": "string", "minLength": 1, "maxLength": 100, "pattern": "\\S" },
        "runs": {
          "type": "array",
          "items": {
            "type": "object",
            "required": ["cell", "engine", "at", "status"],
            "properties": {
              "cell": { "$ref": "#/$defs/id" },
              "notebook": { "$ref": "#/$defs/id", "description": "Required when two notebooks use the same cell id." },
              "engine": { "enum": ["duckdb-native", "duckdb-wasm"] },
              "at": { "type": "string", "pattern": "^\\d{4}-\\d{2}-\\d{2}T\\d{2}:\\d{2}(:\\d{2}(\\.\\d+)?)?(Z|[+-]\\d{2}:\\d{2})$" },
              "status": { "enum": ["success", "error", "cancelled"] }
            }
          },
          "description": "Runs recorded by the producer. An importer shows them as history and never re-runs them."
        }
      }
    },
    "extensions": { "type": "object", "description": "Opaque: kept as is by an import and written back by an export." }
  },
  "$defs": {
    "id": { "type": "string", "pattern": "^[A-Za-z0-9][A-Za-z0-9_-]{0,63}$" }
  }
}
